[
  {
    "id": "6.1",
    "title": "Starting Credits",
    "page": 6,
    "source": {
      "book": "Player's Survival Guide",
      "system": "mothership-1e",
      "version": "1.2",
      "page": 6,
      "section": "6.1"
    }
  },
  {
    "id": "11.1",
    "title": "Pets",
    "page": 11,
    "source": {
      "book": "Player's Survival Guide",
      "system": "mothership-1e",
      "version": "1.2",
      "page": 11,
      "section": "11.1"
    }
  },
  {
    "id": "11.2",
    "title": "Carrying Capacity",
    "page": 11,
    "source": {
      "book": "Player's Survival Guide",
      "system": "mothership-1e",
      "version": "1.2",
      "page": 11,
      "section": "11.2"
    }
  },
  {
    "id": "16.1",
    "title": "How To Be A Great Player",
    "page": 16,
    "source": {
      "book": "Player's Survival Guide",
      "system": "mothership-1e",
      "version": "1.2",
      "page": 16,
      "section": "16.1"
    }
  },
  {
    "id": "17.1",
    "title": "Dice Notation",
    "page": 17,
    "source": {
      "book": "Player's Survival Guide",
      "system": "mothership-1e",
      "version": "1.2",
      "page": 17,
      "section": "17.1"
    }
  },
  {
    "id": "18.1",
    "title": "Stat Checks",
    "page": 18,
    "source": {
      "book": "Player's Survival Guide",
      "system": "mothership-1e",
      "version": "1.2",
      "page": 18,
      "section": "18.1"
    }
  },
  {
    "id": "18.3",
    "title": "What Is Your High Score?",
    "page": 18,
    "source": {
      "book": "Player's Survival Guide",
      "system": "mothership-1e",
      "version": "1.2",
      "page": 18,
      "section": "18.3"
    }
  },
  {
    "id": "18.2",
    "title": "Saves",
    "page": 18,
    "source": {
      "book": "Player's Survival Guide",
      "system": "mothership-1e",
      "version": "1.2",
      "page": 18,
      "section": "18.2"
    }
  },
  {
    "id": "19.1",
    "title": "Modifying Stat Checks & Saves",
    "page": 19,
    "source": {
      "book": "Player's Survival Guide",
      "system": "mothership-1e",
      "version": "1.2",
      "page": 19,
      "section": "19.1"
    }
  },
  {
    "id": "20.1",
    "title": "How Do I Gain Stress?",
    "page": 20,
    "source": {
      "book": "Player's Survival Guide",
      "system": "mothership-1e",
      "version": "1.2",
      "page": 20,
      "section": "20.1"
    }
  },
  {
    "id": "20.2",
    "title": "How Do I Relieve Stress?",
    "page": 20,
    "source": {
      "book": "Player's Survival Guide",
      "system": "mothership-1e",
      "version": "1.2",
      "page": 20,
      "section": "20.2"
    }
  },
  {
    "id": "21.1",
    "title": "What Is A Panic Check?",
    "page": 21,
    "source": {
      "book": "Player's Survival Guide",
      "system": "mothership-1e",
      "version": "1.2",
      "page": 21,
      "section": "21.1"
    }
  },
  {
    "id": "21.2",
    "title": "When To Make Panic Checks",
    "page": 21,
    "source": {
      "book": "Player's Survival Guide",
      "system": "mothership-1e",
      "version": "1.2",
      "page": 21,
      "section": "21.2"
    }
  },
  {
    "id": "21.3",
    "title": "Conditions",
    "page": 21,
    "source": {
      "book": "Player's Survival Guide",
      "system": "mothership-1e",
      "version": "1.2",
      "page": 21,
      "section": "21.3"
    }
  },
  {
    "id": "22.1",
    "title": "No Skill (+0)",
    "page": 22,
    "source": {
      "book": "Player's Survival Guide",
      "system": "mothership-1e",
      "version": "1.2",
      "page": 22,
      "section": "22.1"
    }
  },
  {
    "id": "22.2",
    "title": "Trained Skills (+10)",
    "page": 22,
    "source": {
      "book": "Player's Survival Guide",
      "system": "mothership-1e",
      "version": "1.2",
      "page": 22,
      "section": "22.2"
    }
  },
  {
    "id": "23.1",
    "title": "Expert Skills (+15)",
    "page": 23,
    "source": {
      "book": "Player's Survival Guide",
      "system": "mothership-1e",
      "version": "1.2",
      "page": 23,
      "section": "23.1"
    }
  },
  {
    "id": "23.2",
    "title": "Master Skills (+20)",
    "page": 23,
    "source": {
      "book": "Player's Survival Guide",
      "system": "mothership-1e",
      "version": "1.2",
      "page": 23,
      "section": "23.2"
    }
  },
  {
    "id": "24.1",
    "title": "Train A Skill",
    "page": 24,
    "source": {
      "book": "Player's Survival Guide",
      "system": "mothership-1e",
      "version": "1.2",
      "page": 24,
      "section": "24.1"
    }
  },
  {
    "id": "25.1",
    "title": "Military Training",
    "page": 25,
    "source": {
      "book": "Player's Survival Guide",
      "system": "mothership-1e",
      "version": "1.2",
      "page": 25,
      "section": "25.1"
    }
  },
  {
    "id": "26.1",
    "title": "Turn Order",
    "page": 26,
    "source": {
      "book": "Player's Survival Guide",
      "system": "mothership-1e",
      "version": "1.2",
      "page": 26,
      "section": "26.1"
    }
  },
  {
    "id": "26.2",
    "title": "Surprise",
    "page": 26,
    "source": {
      "book": "Player's Survival Guide",
      "system": "mothership-1e",
      "version": "1.2",
      "page": 26,
      "section": "26.2"
    }
  },
  {
    "id": "27.1",
    "title": "What Can I Do?",
    "page": 27,
    "source": {
      "book": "Player's Survival Guide",
      "system": "mothership-1e",
      "version": "1.2",
      "page": 27,
      "section": "27.1"
    }
  },
  {
    "id": "28.1",
    "title": "How Do I Attack?",
    "page": 28,
    "source": {
      "book": "Player's Survival Guide",
      "system": "mothership-1e",
      "version": "1.2",
      "page": 28,
      "section": "28.1"
    }
  },
  {
    "id": "28.2",
    "title": "Damage",
    "page": 28,
    "source": {
      "book": "Player's Survival Guide",
      "system": "mothership-1e",
      "version": "1.2",
      "page": 28,
      "section": "28.2"
    }
  },
  {
    "id": "28.3",
    "title": "Armor",
    "page": 28,
    "source": {
      "book": "Player's Survival Guide",
      "system": "mothership-1e",
      "version": "1.2",
      "page": 28,
      "section": "28.3"
    }
  },
  {
    "id": "28.4",
    "title": "Cover",
    "page": 28,
    "source": {
      "book": "Player's Survival Guide",
      "system": "mothership-1e",
      "version": "1.2",
      "page": 28,
      "section": "28.4"
    }
  },
  {
    "id": "29.1",
    "title": "What Are Wounds?",
    "page": 29,
    "source": {
      "book": "Player's Survival Guide",
      "system": "mothership-1e",
      "version": "1.2",
      "page": 29,
      "section": "29.1"
    }
  },
  {
    "id": "29.2",
    "title": "Death",
    "page": 29,
    "source": {
      "book": "Player's Survival Guide",
      "system": "mothership-1e",
      "version": "1.2",
      "page": 29,
      "section": "29.2"
    }
  },
  {
    "id": "30.1",
    "title": "Adjacent",
    "page": 30,
    "source": {
      "book": "Player's Survival Guide",
      "system": "mothership-1e",
      "version": "1.2",
      "page": 30,
      "section": "30.1"
    }
  },
  {
    "id": "31.1",
    "title": "Close Range",
    "page": 31,
    "source": {
      "book": "Player's Survival Guide",
      "system": "mothership-1e",
      "version": "1.2",
      "page": 31,
      "section": "31.1"
    }
  },
  {
    "id": "31.2",
    "title": "Long Range",
    "page": 31,
    "source": {
      "book": "Player's Survival Guide",
      "system": "mothership-1e",
      "version": "1.2",
      "page": 31,
      "section": "31.2"
    }
  },
  {
    "id": "31.3",
    "title": "Extreme Range",
    "page": 31,
    "source": {
      "book": "Player's Survival Guide",
      "system": "mothership-1e",
      "version": "1.2",
      "page": 31,
      "section": "31.3"
    }
  },
  {
    "id": "32.1",
    "title": "Atmospheres",
    "page": 32,
    "source": {
      "book": "Player's Survival Guide",
      "system": "mothership-1e",
      "version": "1.2",
      "page": 32,
      "section": "32.1"
    }
  },
  {
    "id": "32.2",
    "title": "Bleeding",
    "page": 32,
    "source": {
      "book": "Player's Survival Guide",
      "system": "mothership-1e",
      "version": "1.2",
      "page": 32,
      "section": "32.2"
    }
  },
  {
    "id": "32.3",
    "title": "Cryosickness",
    "page": 32,
    "source": {
      "book": "Player's Survival Guide",
      "system": "mothership-1e",
      "version": "1.2",
      "page": 32,
      "section": "32.3"
    }
  },
  {
    "id": "32.4",
    "title": "Exhaustion",
    "page": 32,
    "source": {
      "book": "Player's Survival Guide",
      "system": "mothership-1e",
      "version": "1.2",
      "page": 32,
      "section": "32.4"
    }
  },
  {
    "id": "32.5",
    "title": "Food & Water",
    "page": 32,
    "source": {
      "book": "Player's Survival Guide",
      "system": "mothership-1e",
      "version": "1.2",
      "page": 32,
      "section": "32.5"
    }
  },
  {
    "id": "33.1",
    "title": "Oxygen",
    "page": 33,
    "source": {
      "book": "Player's Survival Guide",
      "system": "mothership-1e",
      "version": "1.2",
      "page": 33,
      "section": "33.1"
    }
  },
  {
    "id": "33.2",
    "title": "Radiation",
    "page": 33,
    "source": {
      "book": "Player's Survival Guide",
      "system": "mothership-1e",
      "version": "1.2",
      "page": 33,
      "section": "33.2"
    }
  },
  {
    "id": "33.3",
    "title": "Stimpak Overdose",
    "page": 33,
    "source": {
      "book": "Player's Survival Guide",
      "system": "mothership-1e",
      "version": "1.2",
      "page": 33,
      "section": "33.3"
    }
  },
  {
    "id": "33.4",
    "title": "Temperature",
    "page": 33,
    "source": {
      "book": "Player's Survival Guide",
      "system": "mothership-1e",
      "version": "1.2",
      "page": 33,
      "section": "33.4"
    }
  },
  {
    "id": "34.1",
    "title": "Short Term Recovery",
    "page": 34,
    "source": {